locationid,Applicant,FacilityType,cnn,LocationDescription,Address,blocklot,block,lot,permit,Status,FoodItems
1741554,Philz Coffee Truck,Truck,12323000,SUTTER ST: POWELL ST to MASON ST (500 - 599),556 SUTTER ST,284009,284,9,23MFF-00045,APPROVED,Hot coffee: iced coffee: hot chocolate: tea: pastries
1509787,El Gallo Jiro,Truck,1260000,23RD ST: TREAT AVE to FOLSOM ST (3052 - 3099),3055 23RD ST,3640039,3640,39,21MFF-00011,EXPIRED,Burritos: Giros: Tortas: Quesadillas: Tacos & Various Beverages
1568971,Fillmore Square,Truck,5071000,EDDY ST: WEBSTER ST to FILLMORE ST (1400 - 1499),1290 FILLMORE ST,749019,749,19,21MFF-00101,EXPIRED,Breakfast and lunch items with a nod to various cultures
1341056,Kettle Corn Star,Push Cart,8746103,MARKET ST: YERBA BUENA LN to 04TH ST \ ELLIS ST \ STOCKTON ST (767 - 799) -- SOUTH --,773 MARKET ST,3706096,3706,96,19MFF-00105,EXPIRED,Kettle Corn: Funnel Cakes: Lemonade: Beverages: Flan: Hot Dogs: Falafel: Hot and Cold Sandwiches: French Fries: Baklava and Pastries
1514027,F & C Catering,Truck,1403000,25TH ST: MICHIGAN ST to ILLINOIS ST (700 - 799),700 25TH ST,4244004,4244,4,21MFF-00035,EXPIRED,Cold Truck: Hot/Cold Sandwiches: Water: Soda: Juice: Snacks: Milk: Candies: Canned Food: Soups: Cup of Noodles: Fruit: Salad
963989,Singh Brothers Ice Cream,Truck,13780000,YOSEMITE AVE: INGALLS ST to JENNINGS ST (1400 - 1499),1420 YOSEMITE AVE,4831012,4831,12,17MFF-0182,REQUESTED,Ice Cream: Pre-Packaged Chips: Candies: Bottled Water & Canned SODA
1089697,El Tonayense #60,Truck,6746000,HARRISON ST: 17TH ST to MARIPOSA ST (2050 - 2149),401 TREAT AVE,3573023,3573,23,18MFF-0004,REQUESTED,Tacos: Burritos: Tortas: Quesadillas: Drinks
1733610,Buenafe,Truck,10927000,RANKIN ST: DAVIDSON AVE to EVANS AVE (200 - 299),220 RANKIN ST,5228001,5228,1,23MFF-00025,APPROVED,Tacos: Burritos: Quesadillas: Tortas
1587393,Truly Food & More,Truck,6148201,GENEVA AVE: PRAGUE ST to LINDA VISTA STPS (1500 - 1598) -- SOUTH --,1500 GENEVA AVE,6418065,6418,65,21MFF-00151,REQUESTED,Latin Food: Tacos: Pupusas: Vegetables: Salad: Water: Sodas
1585475,"San Francisco Street Foods, Inc.",Push Cart,30049000,DRUMM ST: CALIFORNIA ST intersection,5 THE EMBARCADERO,0234 017,234,17,21MFF-00146,EXPIRED,Hot dogs: condiments: soft pretzels: soft drinks: coffee: cold beverages: pastries: bakery goods: cookies: ice cream: candy: soups: churros: chestnuts: nuts: fresh fruit: fruit juices: desserts: potato chips and popcorn.
953001,Wonder Philly,Push Cart,270002,04TH ST: BERRY ST to MISSION CREEK (900 - 999),960 04TH ST,8708002,8708,2,17MFF-0166,ISSUED,Hot dogs: sausages: cheesesteaks: chips: drinks
1332935,Mini Mobile Food Catering,Truck,110000,01ST ST: CLEMENTINA ST to FOLSOM ST (245 - 299),245 01ST ST,3737012,3737,12,19MFF-00041,EXPIRED,Cold Truck: Corn Dogs: Noodle Soups: Candy: Pre-packaged Snacks: Sandwiches: Chips: Coffee: Tea: Various Beverages
1723802,Natan's Catering,Truck,0,,Assessors Block 4103/Lot023A,4103023A,4103,023A,23MFF-00006,APPROVED,Burgers: melts: hot dogs: burritos:sandwiches: fries: onion rings: drinks
1591839,Tacos Rodriguez,Truck,11542000,SANSOME ST: SUTTER ST to BUSH ST (1 - 99),1 SANSOME ST,289003,289,3,22MFF-00024,SUSPEND,Tacos: burritos: quesadillas: soda & water
1744376,HalalCartSF LLC,Push Cart,8741101,MARKET ST: FREMONT ST \ FRONT ST to 01ST ST \ BUSH ST (401 - 499) -- SOUTH --,455 MARKET ST,3709012,3709,12,23MFF-00051,REQUESTED,Gyros: Kebabs: soft drinks: and water
1575193,Park's Catering,Truck,8700000,MARIN ST: KANSAS ST to HWY 101 N ON RAMP (2500 - 2599),2525 MARIN ST,4343001D,4343,001D,21MFF-00115,EXPIRED,Cold Truck: Hamburger: cheeseburgers: hot dogs: hot sandwiches: cold sandwiches: egg muffins: cup of noodles: corn dogs: canned soup: coffee: hot cocoa: hot tea: gatorade: juice: milk: soda: water: fruits: fruit salad: rice pudding: yogurt: candy bars: chips: cookies: donuts: granola bars: muffins
1591824,Cochinita,Truck,142000,02ND ST: BRYANT ST to TABER PL (500 - 518),501 02ND ST,3774067,3774,67,22MFF-00021,EXPIRED,Mexican Food: Yucatan Food: Street Food
1735284,El Alambre,Truck,11832000,SHOTWELL ST: 14TH ST to 15TH ST (1 - 99),1800 FOLSOM ST,3549083,3549,83,23MFF-00034,APPROVED,Tacos: Burritos: Quesadillas: Tortas
1732700,Roadside Rotisserie Corporation / Country Grill,Truck,3419000,BUSH ST: 01ST ST \ MARKET ST to BATTERY ST (1 - 99),1 BUSH ST,290011,290,11,23MFF-00021,APPROVED,Rotisserie Chicken: Ribs: Kickass Salad: Potatos w/fat dripping: chicken wrap.
1738247,Zuri Food Facilities,Truck,8722000,MARIPOSA ST: ARKANSAS ST to CAROLINA ST (1500 - 1699),1601 MARIPOSA ST,4006005,4006,5,23MFF-00037,APPROVED,Peruvian Food Served Hot
1658693,Bonito Poke,Truck,107000,01ST ST: HOWARD ST to TEHAMA ST (200 - 231),505 HOWARD ST,3736183,3736,183,22MFF-00071,REQUESTED,Bonito Poke Bowls & Various Drinks
1336736,Quan Catering,Truck,2476000,CESAR CHAVEZ ST: CONNECTICUT ST to EVANS AVE (1900 - 2099),2190 CESAR CHAVEZ ST,4324002,4324,2,19MFF-00055,EXPIRED,Cold Truck: Soft drinks: cup cakes: potato chips: cookies: gum: sandwiches (hot & cold): peanuts: muffins: coff (hot & cold): water: juice: yoplait: milk: orange juice: sunflower seeds: can foods: burritos: buscuits: chimichangas: rice krispies
1729512,Senor Sisig,Truck,5170000,ELLIS ST: POWELL ST to CYRIL MAGNIN ST (100 - 148),120 ELLIS ST,326005,326,5,23MFF-00010,APPROVED,Filipino fusion food: taco: burrito: nachos: rice plates
1621287,Street Meet,Truck,13057001,VALENCIA ST: 14TH ST to ROSA PARKS LN (300 - 337),306 VALENCIA ST,3546001,3546,1,22MFF-00033,REQUESTED,Burritos: Tacos: Tortas: Quesadillas & Various Drinks.
1738641,Eva's Catering,Truck,10006000,ORTEGA ST: 18TH AVE to 19TH AVE (1100 - 1199),1900 19TH AVE,2116028,2116,28,23MFF-00042,APPROVED,Cold Truck: Burrito: Corn Dog: Salads: Sandwiches: Quesadilla: Tacos: Fried Rice: Cow Mein: Chinese Rice: Noodle Plates: Soup: Bacon: Eggs: Ham: Avacado: Sausages: Beverages
1163795,"SOHOMEI, LLC",Truck,9058000,MINNESOTA ST: 23RD ST to 24TH ST (1200 - 1299),1240 MINNESOTA ST,4228015,4228,15,18MFF-0028,REQUESTED,COLD TRUCK. Deli: bbq chicken skewer: Chinese spring roll: Chinese fried rice/noodle: fried chicken leg/wing: bbq chicken sandwich: chicken cheese burger: burrito: lumpia. Snack: sunflower seeds: muffins: chips: snickers: kit-kat: 10 types of chocolate. Drinks: Coke: 7-Up: Dr. Pepper: Pepsi: Redbull: Vitamin Water: Rockstar: Coconut Juice: Water. Hot drinks: coffee: tea.
1163405,Julie's Hot Dogs,Truck,9121000,MISSION ST: 19TH ST to 20TH ST (2300 - 2399),2365 MISSION ST,3595024,3595,24,17MFF-0190,EXPIRED,Hot dogs: Bacon wrapped hot dogs: soda: water: sports drinks: energy drinks: chips
1163798,"SOHOMEI, LLC",Truck,7033000,HOWARD ST: 01ST ST to MALDEN ALY (500 - 589),501 HOWARD ST,3736001,3736,1,18MFF-0028,REQUESTED,COLD TRUCK. Deli: bbq chicken skewer: Chinese spring roll: Chinese fried rice/noodle: fried chicken leg/wing: bbq chicken sandwich: chicken cheese burger: burrito: lumpia. Snack: sunflower seeds: muffins: chips: snickers: kit-kat: 10 types of chocolate. Drinks: Coke: 7-Up: Dr. Pepper: Pepsi: Redbull: Vitamin Water: Rockstar: Coconut Juice: Water. Hot drinks: coffee: tea.
1575195,Park's Catering,Truck,9504000,NAPOLEON ST: EVANS AVE \ TOLAND ST to JERROLD AVE (25 - 299),250 NAPOLEON ST,4343021,4343,21,21MFF-00115,EXPIRED,Cold Truck: Hamburger: cheeseburgers: hot dogs: hot sandwiches: cold sandwiches: egg muffins: cup of noodles: corn dogs: canned soup: coffee: hot cocoa: hot tea: gatorade: juice: milk: soda: water: fruits: fruit salad: rice pudding: yogurt: candy bars: chips: cookies: donuts: granola bars: muffins
1733611,Buenafe,Truck,5335000,EVANS AVE: PHELPS ST to QUINT ST (1600 - 1699),750 PHELPS ST,5280001,5280,1,23MFF-00025,APPROVED,Tacos: Burritos: Quesadillas: Tortas
1660690,"Halal Cart, LLC",Push Cart,8737101,MARKET ST: STEUART ST to SPEAR ST (1 - 99) -- SOUTH --,1 MARKET ST,3713006,3713,6,22MFF-00090,EXPIRED,kebabs: halal gyro: grilled halal meat: refreshments
1723815,Natan's Catering,Truck,381000,07TH ST: HOOPER ST to IRWIN ST (1100 - 1199),1140 07TH ST,3820002,3820,2,23MFF-00006,APPROVED,Burgers: melts: hot dogs: burritos:sandwiches: fries: onion rings: drinks
1587523,"Chairman SF, LLC",Truck,5169000,ELLIS ST: 04TH ST \ MARKET ST \ STOCKTON ST to POWELL ST (1 - 99),34 ELLIS ST,307008,307,8,21MFF-00153,EXPIRED,Baos: bowls & drinks
1336742,Quan Catering,Truck,3524000,CALIFORNIA ST: DRUMM ST to DAVIS ST (1 - 99),50 CALIFORNIA ST,235022,235,22,19MFF-00055,EXPIRED,Cold Truck: Soft drinks: cup cakes: potato chips: cookies: gum: sandwiches (hot & cold): peanuts: muffins: coff (hot & cold): water: juice: yoplait: milk: orange juice: sunflower seeds: can foods: burritos: buscuits: chimichangas: rice krispies
1658696,Bonito Poke,Truck,7165000,ILLINOIS ST: 16TH ST to MARIPOSA ST \ TERRY A FRANCOIS BLVD (400 - 599),409 ILLINOIS ST,3940003,3940,3,22MFF-00071,REQUESTED,Bonito Poke Bowls & Various Drinks
1611739,Kid Abelha - Brazilian Hamburgers,Truck,9504000,NAPOLEON ST: EVANS AVE \ TOLAND ST to JERROLD AVE (25 - 299),2045 EVANS AVE,4343002,4343,2,21MFF-00070,EXPIRED,Brazilian Hamburgers
1535607,Wu Wei LLC dba MoBowl,Truck,13403000,WASHINGTON ST: THE EMBARCADERO to DRUMM ST (1 - 99),370 DRUMM ST,201012,201,12,21MFF-00076,EXPIRED,Various types of meat: veggie: and seafood bowls.
1741653,Truly Food & More,Truck,107000,01ST ST: HOWARD ST to TEHAMA ST (200 - 231),505 HOWARD ST,3736183,3736,183,23MFF-00046,APPROVED,Latin Food: Tacos: Pupusas: Vegetables: Salad: Waters: Sodas
1738240,Zuri Food Facilities,Truck,141000,02ND ST: STILLMAN ST to BRYANT ST (454 - 499),490 02ND ST,3763007,3763,7,23MFF-00035,APPROVED,Peruvian Food Served Hot
1174517,CC Acquisition LLC,Push Cart,8739201,MARKET ST: MAIN ST to BEALE ST \ DAVIS ST \ PINE ST (214 - 298) -- NORTH --,298 MARKET ST,264004,264,4,18MFF-0033,REQUESTED,Indian Chai (Tea)
1568973,Fillmore Square,Truck,5543000,FILLMORE ST: TURK ST to EDDY ST (1200 - 1299),1245 FILLMORE ST,750019,750,19,21MFF-00101,EXPIRED,Breakfast and lunch items with a nod to various cultures
1658387,BH & MT LLC,Truck,10048000,OTIS ST: GOUGH ST \ MCCOPPIN ST to 13TH ST \ DUBOCE AVE \ HWY 101 NORTHBOUND RAMP \ MISSION ST (100 - 199),170 OTIS ST,3513007,3513,7,22MFF-00059,EXPIRED,Cold Truck: Breakfast: Sandwiches: Salads: Pre-Packaged Snacks: Beverages
1723809,Natan's Catering,Truck,185205,,1650 03RD ST,8711007,8711,7,23MFF-00006,APPROVED,Burgers: melts: hot dogs: burritos:sandwiches: fries: onion rings: drinks
1591827,Cochinita,Truck,3285000,BRYANT ST: 04TH ST \ I-80 E OFF RAMP to 05TH ST \ I-80 E ON RAMP (600 - 699),617 BRYANT ST,3777055,3777,55,22MFF-00021,EXPIRED,Mexican Food: Yucatan Food: Street Food
963992,Singh Brothers Ice Cream,Truck,10810000,QUESADA AVE: CRISP RD to HAWES ST (1170 - 1199),1191 QUESADA AVE,4763042,4763,42,17MFF-0182,REQUESTED,Ice Cream: Pre-Packaged Chips: Candies: Bottled Water & Canned SODA
1591779,Street Meet,Truck,6552000,GROVE ST: 08TH ST \ HYDE ST \ MARKET ST to LARKIN ST (1 - 55),30 GROVE ST,354001,354,1,22MFF-00009,SUSPEND,Burritos: Tacos: Quesadillas: Tortas: Carne Asada Fries and various drinks
1332936,Mini Mobile Food Catering,Truck,2138000,ALAMEDA ST: HAMPSHIRE ST to BRYANT ST (2400 - 2599),Assessors Block 3905/Lot011,3905011,3905,11,19MFF-00041,EXPIRED,Cold Truck: Corn Dogs: Noodle Soups: Candy: Pre-packaged Snacks: Sandwiches: Chips: Coffee: Tea: Various Beverages
1575181,Park's Catering,Truck,2477000,CESAR CHAVEZ ST: EVANS AVE to KANSAS ST (2100 - 2550),2323 CESAR CHAVEZ ST,4342001,4342,1,21MFF-00115,EXPIRED,Cold Truck: Hamburger: cheeseburgers: hot dogs: hot sandwiches: cold sandwiches: egg muffins: cup of noodles: corn dogs: canned soup: coffee: hot cocoa: hot tea: gatorade: juice: milk: soda: water: fruits: fruit salad: rice pudding: yogurt: candy bars: chips: cookies: donuts: granola bars: muffins
1611740,Kid Abelha - Brazilian Hamburgers,Truck,9504000,NAPOLEON ST: EVANS AVE \ TOLAND ST to JERROLD AVE (25 - 299),125 NAPOLEON ST,5230021,5230,21,21MFF-00070,EXPIRED,Brazilian Hamburgers
1090090,Tacos El Primo,Truck,13660000,WILLIAMS AVE: APOLLO ST to PHELPS ST \ VESTA ST (300 - 399),345 WILLIAMS AVE,5423A009,5423A,9,18MFF-0006,REQUESTED,Mexican food: tacos: burritos: tortas: various meat and chicken and fish plate: chile relleno plate: fish plate: bread: flan: rice pudding: bread: fruit juice: vegetable juice: coffee: tea
1591822,Cochinita,Truck,1329000,24TH ST: UTAH ST to POTRERO AVE (2600 - 2699),2601 24TH ST,4264001,4264,1,22MFF-00020,EXPIRED,Panushos: Salbutes: Salad: Rice: Beans: Cochinita: etc.
1591783,FRUITYMANIA,Push Cart,8747202,MARKET ST: 04TH ST \ ELLIS ST \ STOCKTON ST to POWELL ST (800 - 890) -- NORTH --,870 MARKET ST,329005,329,5,22MFF-00011,SUSPEND,Fruit Salads: Fruit Drinks: Can Soda: Water
1723798,Natan's Catering,Truck,0,,Assessors Block 4227/Lot012,4227012,4227,12,23MFF-00006,APPROVED,Burgers: melts: hot dogs: burritos:sandwiches: fries: onion rings: drinks
1657809,"San Francisco Carts & Concessions, Inc. DBA Stanley's Steamers Hot Dogs",Push Cart,6109000,GEARY ST: STOCKTON ST to POWELL ST (200 - 299),251 GEARY ST,314014,314,14,22MFF-00042,EXPIRED,Hot dogs: condiments: soft pretzels: soft drinks: coffee: cold beverages: pastries: bakery goods: cookies: ice cream: candy: soups: churros: chestnuts: nuts: fresh fruit: fruit juices: desserts: potato chips and popcorn.
1733786,MOMO INNOVATION LLC,Truck,3420000,BUSH ST: BATTERY ST to SANSOME ST (100 - 199),1 BUSH ST,290011,290,11,23MFF-00028,APPROVED,Noodles
963981,Singh Brothers Ice Cream,Truck,7428000,JAMESTOWN AVE: GRIFFITH ST to CORONADO ST (800 - 850),800 JAMESTOWN AVE,4973034,4973,34,17MFF-0182,REQUESTED,Ice Cream: Pre-Packaged Chips: Candies: Bottled Water & Canned SODA
1735063,"Bay Area Mobile Catering, Inc. dba. Taqueria Angelica's",Truck,5683000,FOLSOM ST: 11TH ST to NORFOLK ST (1500 - 1548),1501 FOLSOM ST,3521058,3521,58,23MFF-00032,APPROVED,Tacos: burritos: soda & juice
1750910,"The New York Frankfurter Co. of CA, Inc. DBA: Annie's Hot Dogs",Push Cart,8747202,MARKET ST: 04TH ST \ ELLIS ST \ STOCKTON ST to POWELL ST (800 - 890) -- NORTH --,870 MARKET ST,329005,329,5,23MFF-00056,APPROVED,Soft pretzels: hot dogs: sausages: chips: popcorn: soda: espresso: cappucino: pastry: ica cream: ices: italian sausage: shish-ka-bob: churros: juice: water: various drinks
1591811,Flavors of Africa,Truck,9090000,MISSION ST: SHAW ALY to ANTHONY ST (543 - 586),555 MISSION ST,3721120,3721,120,22MFF-00017,SUSPEND,Meat and vegi rice bowls: meat and vegi salad bowls: meat and vegi wraps: drinks and juices.
1575186,Park's Catering,Truck,5329000,EVANS AVE: HUNTERS POINT BLVD to JENNINGS ST \ MIDDLE POINT RD (1031 - 1099),1000 EVANS AVE,4580002,4580,2,21MFF-00115,EXPIRED,Cold Truck: Hamburger: cheeseburgers: hot dogs: hot sandwiches: cold sandwiches: egg muffins: cup of noodles: corn dogs: canned soup: coffee: hot cocoa: hot tea: gatorade: juice: milk: soda: water: fruits: fruit salad: rice pudding: yogurt: candy bars: chips: cookies: donuts: granola bars: muffins
1723801,Natan's Catering,Truck,0,,Assessors Block 5216/Lot030,5216030,5216,30,23MFF-00006,APPROVED,Burgers: melts: hot dogs: burritos:sandwiches: fries: onion rings: drinks
1514028,F & C Catering,Truck,193201,03RD ST: 24TH ST to 25TH ST (2800 - 2898) -- WEST --,2890 03RD ST,4246003,4246,3,21MFF-00035,EXPIRED,Cold Truck: Hot/Cold Sandwiches: Water: Soda: Juice: Snacks: Milk: Candies: Canned Food: Soups: Cup of Noodles: Fruit: Salad
1732542,Bonito Poke,Truck,3528000,CALIFORNIA ST: SANSOME ST to LEIDESDORFF ST (400 - 448),430 CALIFORNIA ST,239029,239,29,23MFF-00016,REQUESTED,Bonito Poke Bowls & Various Drinks
1733787,MOMO INNOVATION LLC,Truck,9090000,MISSION ST: SHAW ALY to ANTHONY ST (543 - 586),555 MISSION ST,3721120,3721,120,23MFF-00028,APPROVED,Noodles
1746285,CARDONA'S FOOD TRUCK,Truck,9114000,MISSION ST: 14TH ST to 15TH ST (1800 - 1899),1888 MISSION ST,3547003,3547,3,23MFF-00052,APPROVED,Tacos: Burritos: Quesadillas: Various Drinks
1552373,Breakfast Embed,Truck,34169000,MISSION ROCK ST: 04TH ST intersection,1200 04TH ST,8711017,8711,17,21MFF-00069,EXPIRED,Coffee: Pastries: Bagels: Sandwiches: Other Items
1738645,Eva's Catering,Truck,3081000,BRANNAN ST: 05TH ST to 06TH ST \ I-280 NORTHBOUND \ I-280 SOUTHBOUND (600 - 699),630 BRANNAN ST,3778004,3778,4,23MFF-00042,APPROVED,Cold Truck: Burrito: Corn Dog: Salads: Sandwiches: Quesadilla: Tacos: Fried Rice: Cow Mein: Chinese Rice: Noodle Plates: Soup: Bacon: Eggs: Ham: Avacado: Sausages: Beverages
949952,"Santana ESG, Inc.",Truck,6754000,HARRISON ST: 21ST ST to 22ND ST (2500 - 2599),2598 HARRISON ST,3613009,3613,9,17MFF-0164,EXPIRED,Tacos: Burritos: Tortas: Quesadillas: Mexican Drinks: Aguas Frescas
1585474,"San Francisco Street Foods, Inc.",Push Cart,7038000,HOWARD ST: 03RD ST to 04TH ST (700 - 799),701 HOWARD ST,3734091,3734,91,21MFF-00145,EXPIRED,Hot dogs: condiments: soft pretzels: soft drinks: coffee: cold beverages: pastries: bakery goods: cookies: ice cream: candy: soups: churros: chestnuts: nuts: fresh fruit: fruit juices: desserts: potato chips and popcorn.
1729507,Senor Sisig,Truck,3525000,CALIFORNIA ST: DAVIS ST to FRONT ST (100 - 199),101 CALIFORNIA ST,263011,263,11,23MFF-00009,APPROVED,Senor Sisig: Filipino fusion food: tacos: burritos: nachos: rice plates. Various beverages.
1738643,Eva's Catering,Truck,1009000,20TH AVE: LAWTON ST to MORAGA ST (1600 - 1699),1650 20TH AVE,3602 103,3602,103,23MFF-00042,APPROVED,Cold Truck: Burrito: Corn Dog: Salads: Sandwiches: Quesadilla: Tacos: Fried Rice: Cow Mein: Chinese Rice: Noodle Plates: Soup: Bacon: Eggs: Ham: Avacado: Sausages: Beverages
1723808,Natan's Catering,Truck,1507000,26TH ST: RHODE ISLAND ST to KANSAS ST (2200 - 2299),Assessors Block 4281a/Lot012A,4281a012A,4281a,012A,23MFF-00006,APPROVED,Burgers: melts: hot dogs: burritos:sandwiches: fries: onion rings: drinks
1747911,El Alambre,Truck,5817000,FRANKLIN ST: MYRTLE ST to GEARY BLVD (1150 - 1199),1188 FRANKLIN ST,714017,714,17,23MFF-00053,APPROVED,Tacos: Burritos: Quesadillas: Nachos Alambres: Choice of Meat: Carne Asada: Carnitas: Pollo: Al Pastor Camarones
1723825,Natan's Catering,Truck,7727000,KANSAS ST: 16TH ST to 17TH ST (300 - 399),350 KANSAS ST,3958001D,3958,001D,23MFF-00006,APPROVED,Burgers: melts: hot dogs: burritos:sandwiches: fries: onion rings: drinks
1552372,Breakfast Embed,Truck,108001,01ST ST: TEHAMA ST to CLEMENTINA ST (232 - 274),234 01ST ST,3736006,3736,6,21MFF-00069,EXPIRED,Coffee: Pastries: Bagels: Sandwiches: Other Items
1612654,Sunset Mercantile/Outer Sunset Farmers Market & Mercantile,Truck,1835000,37TH AVE: QUINTARA ST to RIVERA ST (2100 - 2199),2155 37TH AVE,2094006,2094,6,22MFF-00031,REQUESTED,Multiple Food Trucks & Food Types
1658363,Treats by the Bay LLC,Truck,7034000,HOWARD ST: MALDEN ALY to 02ND ST (574 - 599),201 02ND ST,3736097,3736,97,22MFF-00054,EXPIRED,Prepackaged Kettlecorn
963986,Singh Brothers Ice Cream,Truck,13356000,WALLACE AVE: JENNINGS ST to KEITH ST (1500 - 1599),1550 WALLACE AVE,4829006,4829,6,17MFF-0182,REQUESTED,Ice Cream: Pre-Packaged Chips: Candies: Bottled Water & Canned SODA
1723828,Natan's Catering,Truck,8954000,MENDELL ST: CARGO WAY to NEWHALL ST (1 - 199),151 MENDELL ST,4570019,4570,19,23MFF-00006,APPROVED,Burgers: melts: hot dogs: burritos:sandwiches: fries: onion rings: drinks
1336732,Quan Catering,Truck,194201,03RD ST: 25TH ST to 26TH ST (2900 - 2998) -- WEST --,2920 03RD ST,4295014,4295,14,19MFF-00055,EXPIRED,Cold Truck: Soft drinks: cup cakes: potato chips: cookies: gum: sandwiches (hot & cold): peanuts: muffins: coff (hot & cold): water: juice: yoplait: milk: orange juice: sunflower seeds: can foods: burritos: buscuits: chimichangas: rice krispies
1336741,Quan Catering,Truck,3376000,BURKE AVE: START: 1500-1599 BLOCK to 03RD ST (1500 - 1599),1575 BURKE AVE,5203043,5203,43,19MFF-00055,EXPIRED,Cold Truck: Soft drinks: cup cakes: potato chips: cookies: gum: sandwiches (hot & cold): peanuts: muffins: coff (hot & cold): water: juice: yoplait: milk: orange juice: sunflower seeds: can foods: burritos: buscuits: chimichangas: rice krispies
1721249,El Calamar Perubian Food Truck,Truck,9091000,MISSION ST: ANTHONY ST to 02ND ST (573 - 599),85 02ND ST,3708019,3708,19,23MFF-00004,APPROVED,Lomo Saltado: Jalea: Ceviche: Calamar: Tilapia plate: chicken special. Soda: Water.
1163789,"SOHOMEI, LLC",Truck,131000,02ND ST: JESSIE ST to MISSION ST (69 - 99),85 02ND ST,3708019,3708,19,18MFF-0028,REQUESTED,COLD TRUCK. Deli: bbq chicken skewer: Chinese spring roll: Chinese fried rice/noodle: fried chicken leg/wing: bbq chicken sandwich: chicken cheese burger: burrito: lumpia. Snack: sunflower seeds: muffins: chips: snickers: kit-kat: 10 types of chocolate. Drinks: Coke: 7-Up: Dr. Pepper: Pepsi: Redbull: Vitamin Water: Rockstar: Coconut Juice: Water. Hot drinks: coffee: tea.
1729521,Senor Sisig,Truck,5874000,FRONT ST: BROADWAY to VALLEJO ST (800 - 899),90 BROADWAY,140007,140,7,23MFF-00011,APPROVED,Various menu items & drinks
1723813,Natan's Catering,Truck,2468000,CESAR CHAVEZ ST: 03RD ST to TENNESSEE ST (1000 - 1099),Assessors Block 4315/Lot03008,431503008,4315,3008,23MFF-00006,APPROVED,Burgers: melts: hot dogs: burritos:sandwiches: fries: onion rings: drinks
1738644,Eva's Catering,Truck,305000,05TH ST: WELSH ST to BRANNAN ST (530 - 599),530 05TH ST,3778001B,3778,001B,23MFF-00042,APPROVED,Cold Truck: Burrito: Corn Dog: Salads: Sandwiches: Quesadilla: Tacos: Fried Rice: Cow Mein: Chinese Rice: Noodle Plates: Soup: Bacon: Eggs: Ham: Avacado: Sausages: Beverages
1447794,Street Meet,Truck,7033000,HOWARD ST: 01ST ST to MALDEN ALY (500 - 589),564 HOWARD ST,3721019,3721,19,20MFF-00007,REQUESTED,Tortas: Burritos: Tacos: Churros: Nachos: Asada Fries
1332948,Mini Mobile Food Catering,Truck,8485000,LOOMIS ST: FLOWER ST to WATERLOO ST (120 - 255),491 BAY SHORE BLVD,5598008,5598,8,19MFF-00041,EXPIRED,Cold Truck: Corn Dogs: Noodle Soups: Candy: Pre-packaged Snacks: Sandwiches: Chips: Coffee: Tea: Various Beverages
1163800,"SOHOMEI, LLC",Truck,1177000,22ND ST: SAN BRUNO AVE to UTAH ST (2400 - 2449),2401 22ND ST,4154001,4154,1,18MFF-0028,REQUESTED,COLD TRUCK. Deli: bbq chicken skewer: Chinese spring roll: Chinese fried rice/noodle: fried chicken leg/wing: bbq chicken sandwich: chicken cheese burger: burrito: lumpia. Snack: sunflower seeds: muffins: chips: snickers: kit-kat: 10 types of chocolate. Drinks: Coke: 7-Up: Dr. Pepper: Pepsi: Redbull: Vitamin Water: Rockstar: Coconut Juice: Water. Hot drinks: coffee: tea.
1738313,San Francisco's Hometown Creamery,Truck,10456000,PINE ST: SANSOME ST to CENTURY PL (300 - 340),301 PINE ST,268001,268,1,23MFF-00040,APPROVED,Ice cream & Waffle cones
1163793,"SOHOMEI, LLC",Truck,2488201,CESAR CHAVEZ ST: SOUTH VAN NESS AVE to CAPP ST \ MISSION ST (3300 - 3398) -- NORTH --,3300 CESAR CHAVEZ ST,6571011,6571,11,18MFF-0028,REQUESTED,COLD TRUCK. Deli: bbq chicken skewer: Chinese spring roll: Chinese fried rice/noodle: fried chicken leg/wing: bbq chicken sandwich: chicken cheese burger: burrito: lumpia. Snack: sunflower seeds: muffins: chips: snickers: kit-kat: 10 types of chocolate. Drinks: Coke: 7-Up: Dr. Pepper: Pepsi: Redbull: Vitamin Water: Rockstar: Coconut Juice: Water. Hot drinks: coffee: tea.
1163796,"SOHOMEI, LLC",Truck,4614000,DAVIDSON AVE: QUINT ST to RANKIN ST (1500 - 1599),1580 DAVIDSON AVE,5216029,5216,29,18MFF-0028,REQUESTED,COLD TRUCK. Deli: bbq chicken skewer: Chinese spring roll: Chinese fried rice/noodle: fried chicken leg/wing: bbq chicken sandwich: chicken cheese burger: burrito: lumpia. Snack: sunflower seeds: muffins: chips: snickers: kit-kat: 10 types of chocolate. Drinks: Coke: 7-Up: Dr. Pepper: Pepsi: Redbull: Vitamin Water: Rockstar: Coconut Juice: Water. Hot drinks: coffee: tea.
1544281,Boulangerie La Camionnette,,5622000,FLORIDA ST: MARIPOSA ST to 18TH ST (500 - 599),500 FLORIDA ST,4018001,4018,1,21MFF-00079,REQUESTED,Bread: Pastries: Coffee: Pizza
1723796,Natan's Catering,Truck,0,,Assessors Block 4172/Lot010,4172010,4172,10,23MFF-00006,APPROVED,Burgers: melts: hot dogs: burritos:sandwiches: fries: onion rings: drinks
1591826,Cochinita,Truck,3079000,BRANNAN ST: ZOE ST to 04TH ST (440 - 499),490 BRANNAN ST,3776025,3776,25,22MFF-00021,EXPIRED,Mexican Food: Yucatan Food: Street Food
1723793,Natan's Catering,Truck,0,,Assessors Block 8722/Lot003,8722003,8722,3,23MFF-00006,APPROVED,Burgers: melts: hot dogs: burritos:sandwiches: fries: onion rings: drinks
1723806,Natan's Catering,Truck,1400001,25TH ST: MARYLAND ST to MICHIGAN ST (400 - 699),Assessors Block 4241/Lot002,4241002,4241,2,23MFF-00006,APPROVED,Burgers: melts: hot dogs: burritos:sandwiches: fries: onion rings: drinks
1741555,Philz Coffee Truck,Truck,3528000,CALIFORNIA ST: SANSOME ST to LEIDESDORFF ST (400 - 448),401 CALIFORNIA ST,260001,260,1,23MFF-00045,APPROVED,Hot coffee: iced coffee: hot chocolate: tea: pastries
1575189,Park's Catering,Truck,5582000,ARELIOUS WALKER DR: PALOU AVE to QUESADA AVE (1300 - 1399),Assessors Block 4755/Lot049,4755049,4755,49,21MFF-00115,EXPIRED,Cold Truck: Hamburger: cheeseburgers: hot dogs: hot sandwiches: cold sandwiches: egg muffins: cup of noodles: corn dogs: canned soup: coffee: hot cocoa: hot tea: gatorade: juice: milk: soda: water: fruits: fruit salad: rice pudding: yogurt: candy bars: chips: cookies: donuts: granola bars: muffins
963982,Singh Brothers Ice Cream,Truck,7819000,KEY AVE: JENNINGS ST to 03RD ST (1000 - 1068),1060 KEY AVE,4994002,4994,2,17MFF-0182,REQUESTED,Ice Cream: Pre-Packaged Chips: Candies: Bottled Water & Canned SODA
948140,Eli's Hot Dogs,Push Cart,7504000,JERROLD AVE: BARNEVELD AVE to JERROLD AVE (2351 - 2369),101 BAY SHORE BLVD,5559018,5559,18,17MFF-0155,REQUESTED,various styles of hot dogs & sausages: chips: breakfast sandwiches: chili: soda: water:
