locationid,Applicant,FacilityType,cnn,LocationDescription,Address,blocklot,block,lot,permit,Status,FoodItems
735318,Ziaurehman Amini,Push Cart,30727000,MARKET ST: DRUMM ST intersection,5 THE EMBARCADERO,234017,234,17,15MFF-0159,REQUESTED,
848184,Reecees Soulicious,Truck,2799106,BAY SHORE BLVD: BAY SHORE BLVD to OAKDALE AVE (185 - 299) -- EAST --,201 BAY SHORE BLVD,5559021,5559,21,16MFF-0139,REQUESTED,Fried Chicken: Fried Fish: Greens: Mac & Cheese: Peach Cobbler: and String beans
1047831,The Chef Station,Truck,480000,10TH ST: FELL ST \ MARKET ST \ POLK ST to STEVENSON ST (1 - 18),8 10TH ST,3507041,3507,41,17MFF-0203,REQUESTED,South American/Peruvian food
934516,Scotch Bonnet,Truck,101000,01ST ST: STEVENSON ST to JESSIE ST (21 - 56),50 01ST ST,3708055,3708,55,17MFF-0094,EXPIRED,Jerk chicken: curry chicken: curry goat: curry dhal: Burritos: Fish: Ox tails: rice: beans: veggies.
1343454,Esmeli Catering,Truck,7022000,HOOPER ST: 07TH ST to 08TH ST (100 - 199),Assessors Block /Lot,,,,19MFF-00110,REQUESTED,tacos: burritos: quesadilla: tortas sodas
1334819,tacos y pupusas los trinos,,9158000,MISSION ST: AVALON AVE to COTTER ST (4368 - 4439),4384 MISSION ST,6798004,6798,4,19MFF-00048,REQUESTED,
755221,Fruteria Serrano,,9167000,MISSION ST: OCEAN AVE to PERSIA AVE (4650 - 4699),4650 MISSION ST,6955044,6955,44,16MFF-0011,REQUESTED,Fruits including mangoes: pineapples: coconuts: watermelon: corn: cucumber: potatoes chips: water: Mexican drinks: sodas: juices: snow cones
1337787,Giant Burrito,Truck,6148201,GENEVA AVE: PRAGUE ST to LINDA VISTA STPS (1500 - 1598) -- SOUTH --,1500 GENEVA AVE,6418065,6418,65,19MFF-00088,REQUESTED,Tacos: Burritos: Tostadas: Flautas: Tostadas: Tortas: Pozole Menudo
1367290,Star Taco,,7034000,HOWARD ST: MALDEN ALY to 02ND ST (574 - 599),580 HOWARD ST,3721092,3721,92,19MFF-00128,REQUESTED,Mexican Food
934518,Scotch Bonnet,Truck,11543000,SANSOME ST: BUSH ST to PINE ST (100 - 199),115 SANSOME ST,268002,268,2,17MFF-0094,EXPIRED,Jerk chicken: curry chicken: curry goat: curry dhal: Burritos: Fish: Ox tails: rice: beans: veggies.
812017,SF Street Food,Truck,12320000,SUTTER ST: CLAUDE LN to GRANT AVE (216 - 299),290 SUTTER ST,287014,287,14,16MFF-0126,REQUESTED,Chicken Tikka Masala: Vegetarian Rice Plate: Burritos: Tacos: Mango Lassi
1344202,"Bay Area Dots, LLC",Push Cart,2846000,BEACH ST: HYDE ST to LARKIN ST (700 - 799),900 BEACH ST,405007,405,7,19MFF-00116,REQUESTED,Hot dogs: condiments: soft pretzels: soft drinks: coffee:cold beverages: pastries: bakery goods: cookies: icecream: candy: soups: churros: chestnuts: nuts: fresh fruit: fruit juices: desserts: potato chips and popcorn.
1359707,Union Square Business Improvement District,Truck,8626000,MAIDEN LN: GRANT AVE to STOCKTON ST (100 - 199),Assessors Block /Lot,,,,19MFF-00125,REQUESTED,All types of food except for BBQ on site per fire safety. Partnership with Off the Grid and their fleet of MFF's
1265606,"San Francisco Carts & Concessions, Inc. DBA Stanley's Steamers Hot Dogs",Push Cart,10628000,POST ST: STOCKTON ST to POWELL ST (300 - 399),384 POST ST,295007,295,7,19MFF-00001,REQUESTED,American Food: Hot dogs: pretzels: ice cream: salads: beverages: sandwiches: soup: coffee: pastries:etc.
955616,Tacos Santo Toribio,Truck,12628000,TOLAND ST: NEWCOMB AVE to OAKDALE AVE (900 - 999),928 TOLAND ST,5597A001,5597A,1,17MFF-0171,REQUESTED,tacos
848185,Reecees Soulicious,Truck,211101,03RD ST: NEWCOMB AVE to OAKDALE AVE (4701 - 4799) -- EAST --,4705 03RD ST,5311036,5311,36,16MFF-0139,REQUESTED,Fried Chicken: Fried Fish: Greens: Mac & Cheese: Peach Cobbler: and String beans
848080,Taqueria Lolita,Truck,10927000,RANKIN ST: DAVIDSON AVE to EVANS AVE (200 - 299),1700 EVANS AVE,5227001,5227,1,16MFF-0128,SUSPEND,Tacos: burritos: quesadillas: combination plates: tortas: tostadas
1010174,Julie's Hot Dogs,Truck,9121000,MISSION ST: 19TH ST to 20TH ST (2300 - 2399),2386 MISSION ST,3596119,3596,119,15MFF-0007,REQUESTED,Hot dogs: bacon-wrapped hot dogs: chicken burgers: energy drinks: water and various other drinks.
1265597,"San Francisco Carts & Concessions, Inc. DBA Stanley's Steamers Hot Dogs",Push Cart,10628000,POST ST: STOCKTON ST to POWELL ST (300 - 399),Assessors Block /Lot,,,,19MFF-00001,REQUESTED,American Food: Hot dogs: pretzels: ice cream: salads: beverages: sandwiches: soup: coffee: pastries:etc.
627558,"Off the Grid Services, LLC",Truck,4609000,DAVIS ST: DAVIS CT \ JACKSON ST to BROADWAY (500 - 699),Assessors Block /Lot,,,,15MFF-0039,REQUESTED,varies truck to truck
364218,The Chai Cart,Push Cart,9543000,NEW MONTGOMERY ST: AMBROSE BIERCE ST to MISSION ST (77 - 99),79 NEW MONTGOMERY ST,3707014,3707,14,12MFF-0083,SUSPEND,Hot Indian Chai (Tea)
931093,Swell Cream & Coffee,Truck,12412000,TARAVAL ST: 36TH AVE to SUNSET BLVD (2600 - 2649),2401 36TH AVE,2389001,2389,1,17MFF-0002,REQUESTED,Ice cream: coffee: pastries
997504,Munch India,Truck,10624001,POST ST: MONTGOMERY ST to LICK PL (1 - 40),Assessors Block /Lot,,,,17MFF-0187,REQUESTED,Daily rotating menus consisting of various local & organic vegetable: poultry: meat: seafood : rice & bread dishes.
773095,Athena SF Gyro,Push Cart,30747000,MARKET ST: 11TH ST intersection,10 SOUTH VAN NESS AVE,3506004,3506,4,15MFF-0145,REQUESTED,Gyro pita bread (Lamb or chicken): lamb over rice: chicken over rice: chicken biryani rice: soft drinks
934552,"Casey's Pizza, LLC",Truck,9093000,MISSION ST: NEW MONTGOMERY ST to ANNIE ST (635 - 664),654 MISSION ST,3707019,3707,19,17MFF-0104,EXPIRED,Artisan Pizzas (Margherita: Yukon Potato: Zoe's Pepperoni: Funghi: Brocolli Rabe: Bacon Kale:  Arugula) and Drinks.
934517,Scotch Bonnet,Truck,9297000,MONTGOMERY ST: POST ST to SUTTER ST (1 - 99),25 MONTGOMERY ST,0292001A,292,001A,17MFF-0094,EXPIRED,Jerk chicken: curry chicken: curry goat: curry dhal: Burritos: Fish: Ox tails: rice: beans: veggies.
1089427,Halal Food,Push Cart,3524000,CALIFORNIA ST: DRUMM ST to DAVIS ST (1 - 99),50 CALIFORNIA ST,235022,235,22,18MFF-0003,REQUESTED,rice chicken beef hot dogs and sandwich's and coke and water
934554,"Casey's Pizza, LLC",Truck,12045000,SPEAR ST: MISSION ST to HOWARD ST (100 - 199),100 SPEAR ST,3717001,3717,1,17MFF-0104,EXPIRED,Artisan Pizzas (Margherita: Yukon Potato: Zoe's Pepperoni: Funghi: Brocolli Rabe: Bacon Kale:  Arugula) and Drinks.
934551,"Casey's Pizza, LLC",Truck,5442000,FELL ST: GOUGH ST to OCTAVIA ST (300 - 399),368 FELL ST,817032,817,32,17MFF-0104,EXPIRED,Artisan Pizzas (Margherita: Yukon Potato: Zoe's Pepperoni: Funghi: Brocolli Rabe: Bacon Kale:  Arugula) and Drinks.
934555,"Casey's Pizza, LLC",Truck,11544000,SANSOME ST: PINE ST to CALIFORNIA ST (200 - 299),231 SANSOME ST,260002,260,2,17MFF-0104,EXPIRED,Artisan Pizzas (Margherita: Yukon Potato: Zoe's Pepperoni: Funghi: Brocolli Rabe: Bacon Kale:  Arugula) and Drinks.
773105,Athena SF Gyro,Push Cart,417000,08TH ST: BRANNAN ST to TOWNSEND ST (600 - 699),699 08TH ST,3783009,3783,9,15MFF-0145,REQUESTED,Gyro pita bread (Lamb or chicken): lamb over rice: chicken over rice: chicken biryani rice: soft drinks
839523,Halal Cart of San Francisco,Push Cart,8741201,MARKET ST: FREMONT ST \ FRONT ST to 01ST ST \ BUSH ST (400 - 498) -- NORTH --,1 FRONT ST,266009,266,9,16MFF-0136,REQUESTED,Gyro
837171,Chilifruit,Push Cart,1346000,24TH ST: MISSION ST to OSAGE ALY (3300 - 3322),Assessors Block /Lot,,,,16MFF-0135,REQUESTED,Mangoneadas: Fruit snacks: Chamoyadas: Bionicos
1265569,"San Francisco Carts & Concessions, Inc. DBA Stanley's Steamers Hot Dogs",Push Cart,10678000,POWELL ST: GEARY ST to POST ST (300 - 399),331 POWELL ST,307001,307,1,19MFF-00001,REQUESTED,American Food: Hot dogs: pretzels: ice cream: salads: beverages: sandwiches: soup: coffee: pastries:etc.
839524,Halal Cart of San Francisco,Push Cart,8742101,MARKET ST: 01ST ST \ BUSH ST to 02ND ST (501 - 599) -- SOUTH --,555 MARKET ST,3708057,3708,57,16MFF-0136,REQUESTED,Gyro
1141511,Khalid M Malik,Push Cart,2751000,BATTERY ST: MARKET ST to BUSH ST (1 - 10),Assessors Block /Lot,,,,18MFF-0018,REQUESTED,chicken sandwich: chicken gyro: chicken biryani
1047771,The Chef Station,,4801101,DIVISADERO ST: OAK ST to FELL ST (401 - 499) -- WEST --,425 DIVISADERO ST,1215016,1215,16,17MFF-0202,REQUESTED,South American Peruvian Food - Ceiches: hot wok dishes: hot pastas: rice dishes: and Tapas.
934519,Scotch Bonnet,Truck,3528000,CALIFORNIA ST: SANSOME ST to LEIDESDORFF ST (400 - 448),430 CALIFORNIA ST,239029,239,29,17MFF-0094,EXPIRED,Jerk chicken: curry chicken: curry goat: curry dhal: Burritos: Fish: Ox tails: rice: beans: veggies.
812018,SF Street Food,Truck,9094000,MISSION ST: ANNIE ST to 03RD ST (663 - 699),667 MISSION ST,3722067,3722,67,16MFF-0126,REQUESTED,Chicken Tikka Masala: Vegetarian Rice Plate: Burritos: Tacos: Mango Lassi
931094,Swell Cream & Coffee,Truck,12410000,TARAVAL ST: 34TH AVE to 35TH AVE (2400 - 2499),2450 TARAVAL ST,2363022,2363,22,17MFF-0002,REQUESTED,Ice cream: coffee: pastries
1265607,"San Francisco Carts & Concessions, Inc. DBA Stanley's Steamers Hot Dogs",Push Cart,6109000,GEARY ST: STOCKTON ST to POWELL ST (200 - 299),Assessors Block /Lot,,,,19MFF-00001,REQUESTED,American Food: Hot dogs: pretzels: ice cream: salads: beverages: sandwiches: soup: coffee: pastries:etc.
840504,Taqueria Lolita,Truck,5336000,EVANS AVE: QUINT ST to RANKIN ST (1700 - 1799),750 PHELPS ST,5280001,5280,1,16MFF-0128,SUSPEND,Tacos: burritos: quesadillas: combination plates: tortas: tostadas
735315,Ziaurehman Amini,Push Cart,4969000,DRUMM ST: MARKET ST to CALIFORNIA ST (1 - 6),1 CALIFORNIA ST,264004,264,4,15MFF-0159,REQUESTED,
1344203,"Bay Area Dots, LLC",Push Cart,25524000,TAYLOR ST: BAY ST intersection,567 BAY ST,43001,43,1,19MFF-00117,REQUESTED,Hot dogs: condiments: soft pretzels: soft drinks: coffee: cold beverages: pastries: bakery goods: cookies: ice cream: candy: soups: churros: chestnuts: nuts: fresh fruit: fruit juices: desserts: potato chips and popcorn.
1400796,El Calamar Perubian Food Truck,Truck,1329000,24TH ST: UTAH ST to POTRERO AVE (2600 - 2699),2615 24TH ST,4264019A,4264,019A,20MFF-00002,REQUESTED,Lomo Saltado: Jalea: Ceviche: Calamari Tilapia Plates: Chicken: Soda: Water.
934553,"Casey's Pizza, LLC",Truck,10624001,POST ST: MONTGOMERY ST to LICK PL (1 - 40),1 POST ST,311015,311,15,17MFF-0104,EXPIRED,Artisan Pizzas (Margherita: Yukon Potato: Zoe's Pepperoni: Funghi: Brocolli Rabe: Bacon Kale:  Arugula) and Drinks.
1337786,Giant Burrito,Truck,2800102,BAY SHORE BLVD: FLOWER ST to CORTLAND AVE (341 - 489) -- EAST --,353 BAY SHORE BLVD,5598030,5598,30,19MFF-00088,REQUESTED,Tacos: Burritos: Tostadas: Flautas: Tostadas: Tortas: Pozole Menudo
1416733,"Off the Grid Services, LLC",Truck,11542000,SANSOME ST: SUTTER ST to BUSH ST (1 - 99),1 BUSH ST,290011,290,11,20MFF-00003,REQUESTED,
1514024,F & C Catering,Truck,0,,Assessors Block /Lot,,,,21MFF-00035,EXPIRED,Cold Truck: Hot/Cold Sandwiches: Water: Soda: Juice: Snacks: Milk: Candies: Canned Food: Soups: Cup of Noodles: Fruit: Salad
1034228,Julie's Hot Dogs,,9114000,MISSION ST: 14TH ST to 15TH ST (1800 - 1899),1850 MISSION ST,3547261,3547,261,17MFF-0196,REQUESTED,Hot dogs: bacon wrap hot dogs: chicken burgers: energy drinks: water & various drinks
1591997,Lerso,Truck,9108000,MISSION ST: 10TH ST to 11TH ST (1400 - 1499),1450 MISSION ST,3507040,3507,40,22MFF-00026,SUSPEND,Pernil Asado: Ropa Vieja: Arroz con Pollo: Cuban Sandwich: Croquetas Fritas: Tostones: Platanos Maduros: Yuca Frita
963993,Singh Brothers Ice Cream,Truck,11783000,SHAFTER AVE: HAWES ST to INGALLS ST (1200 - 1299),1207 SHAFTER AVE,4792001A,4792,001A,17MFF-0182,REQUESTED,Ice Cream: Pre-Packaged Chips: Candies: Bottled Water & Canned SODA
1741557,Philz Coffee Truck,Truck,9306000,MONTGOMERY ST: COLUMBUS AVE \ WASHINGTON ST to JACKSON ST (700 - 799),735 MONTGOMERY ST,195001,195,1,23MFF-00045,APPROVED,Hot coffee: iced coffee: hot chocolate: tea: pastries
963978,Singh Brothers Ice Cream,Truck,6961000,HOLLISTER AVE: HAWES ST to INGALLS ST (1000 - 1099),1000 HOLLISTER AVE,4943002,4943,2,17MFF-0182,REQUESTED,Ice Cream: Pre-Packaged Chips: Candies: Bottled Water & Canned SODA
1153604,SPUNBYSS,Truck,136000,02ND ST: TEHAMA ST to CLEMENTINA ST (224 - 273),240 02ND ST,3735055,3735,55,18MFF-0021,REQUESTED,American classic slider:  fried chicken slider: fried chicken skin: wedge cut fries: regular cut fries: handcrafted sodas: spring salad
1723823,Natan's Catering,Truck,7166000,ILLINOIS ST: MARIPOSA ST \ TERRY A FRANCOIS BLVD to 18TH ST (600 - 699),Assessors Block 3941/Lot001,3941001,3941,1,23MFF-00006,APPROVED,Burgers: melts: hot dogs: burritos:sandwiches: fries: onion rings: drinks
1741556,Philz Coffee Truck,Truck,8701000,MARINA BLVD: LAGUNA ST to BEACH ST \ BUCHANAN ST \ LOWER FORT MASON ST (1 - 99),15 MARINA BLVD,446002,446,2,23MFF-00045,APPROVED,Hot coffee: iced coffee: hot chocolate: tea: pastries
1658694,Bonito Poke,Truck,3528000,CALIFORNIA ST: SANSOME ST to LEIDESDORFF ST (400 - 448),430 CALIFORNIA ST,239029,239,29,22MFF-00071,REQUESTED,Bonito Poke Bowls & Various Drinks
1039786,Julie's Hot Dogs,,9117000,MISSION ST: 17TH ST to CLARION ALY (2100 - 2131),2101 MISSION ST,3575091,3575,91,17MFF-0196,REQUESTED,Hot dogs: bacon wrap hot dogs: chicken burgers: energy drinks: water & various drinks
963990,Singh Brothers Ice Cream,Truck,7479000,JENNINGS ST: VAN DYKE AVE to WALLACE AVE (2100 - 2199),2115 JENNINGS ST,4828021,4828,21,17MFF-0182,REQUESTED,Ice Cream: Pre-Packaged Chips: Candies: Bottled Water & Canned SODA
1738640,Eva's Catering,Truck,10006000,ORTEGA ST: 18TH AVE to 19TH AVE (1100 - 1199),1100 ORTEGA ST,2055019,2055,19,23MFF-00042,APPROVED,Cold Truck: Burrito: Corn Dog: Salads: Sandwiches: Quesadilla: Tacos: Fried Rice: Cow Mein: Chinese Rice: Noodle Plates: Soup: Bacon: Eggs: Ham: Avacado: Sausages: Beverages
963984,Singh Brothers Ice Cream,Truck,4908000,DONNER AVE: INGALLS ST to JENNINGS ST (1400 - 1499),1475 DONNER AVE,4910023,4910,23,17MFF-0182,REQUESTED,Ice Cream: Pre-Packaged Chips: Candies: Bottled Water & Canned SODA
1575177,Park's Catering,Truck,10397000,PHELPS ST: FAIRFAX AVE to SAM JORDANS WAY (500 - 599),525 PHELPS ST,5242015,5242,15,21MFF-00115,EXPIRED,Cold Truck: Hamburger: cheeseburgers: hot dogs: hot sandwiches: cold sandwiches: egg muffins: cup of noodles: corn dogs: canned soup: coffee: hot cocoa: hot tea: gatorade: juice: milk: soda: water: fruits: fruit salad: rice pudding: yogurt: candy bars: chips: cookies: donuts: granola bars: muffins
1730566,DO UC US Mobile Catering,Truck,8700000,MARIN ST: KANSAS ST to HWY 101 N ON RAMP (2500 - 2599),2590 MARIN ST,4339008,4339,8,23MFF-00015,APPROVED,Cold truck: sandwiches: salads: beverages: chips: candy: cookies: coffee: tea: drinks
1738246,Zuri Food Facilities,Truck,12045000,SPEAR ST: MISSION ST to HOWARD ST (100 - 199),100 SPEAR ST,3717001,3717,1,23MFF-00037,APPROVED,Peruvian Food Served Hot
1723820,Natan's Catering,Truck,6759001,HARRISON ST: 26TH ST to KAMILLE CT (3000 - 3048),3040 HARRISON ST,6573001,6573,1,23MFF-00006,APPROVED,Burgers: melts: hot dogs: burritos:sandwiches: fries: onion rings: drinks
1340417,Let's Be Frank,Push Cart,6816000,HAYES ST: GOUGH ST to OCTAVIA ST (400 - 499),425 HAYES ST,817025,817,25,19MFF-00104,EXPIRED,Hot dogs and chili
1163799,"SOHOMEI, LLC",Truck,8848000,MASONIC AVE: MCALLISTER ST to FULTON ST (500 - 599),599 MASONIC AVE,1108 012,1108,12,18MFF-0028,REQUESTED,COLD TRUCK. Deli: bbq chicken skewer: Chinese spring roll: Chinese fried rice/noodle: fried chicken leg/wing: bbq chicken sandwich: chicken cheese burger: burrito: lumpia. Snack: sunflower seeds: muffins: chips: snickers: kit-kat: 10 types of chocolate. Drinks: Coke: 7-Up: Dr. Pepper: Pepsi: Redbull: Vitamin Water: Rockstar: Coconut Juice: Water. Hot drinks: coffee: tea.
1723810,Natan's Catering,Truck,188101,03RD ST: 18TH ST to 19TH ST (2101 - 2199) -- EAST --,2101 03RD ST,4045004,4045,4,23MFF-00006,APPROVED,Burgers: melts: hot dogs: burritos:sandwiches: fries: onion rings: drinks
1575194,Park's Catering,Truck,9206000,MISSISSIPPI ST: START: 1200-1299 BLOCK to CESAR CHAVEZ ST (1200 - 1299),1200 MISSISSIPPI ST,4288003,4288,3,21MFF-00115,EXPIRED,Cold Truck: Hamburger: cheeseburgers: hot dogs: hot sandwiches: cold sandwiches: egg muffins: cup of noodles: corn dogs: canned soup: coffee: hot cocoa: hot tea: gatorade: juice: milk: soda: water: fruits: fruit salad: rice pudding: yogurt: candy bars: chips: cookies: donuts: granola bars: muffins
934719,"Santana ESG, Inc.",Truck,11542000,SANSOME ST: SUTTER ST to BUSH ST (1 - 99),1 SANSOME ST,289003,289,3,17MFF-0122,EXPIRED,Tacos: Burritos: Tortas: Quesadillas: Mexican Drinks: Aguas Frescas
1732583,Plaza Garibaldy,Truck,3529000,CALIFORNIA ST: LEIDESDORFF ST to MONTGOMERY ST (449 - 499),475 CALIFORNIA ST,260010,260,10,23MFF-00018,APPROVED,Tacos: burritos: quesadillas
1575179,Park's Catering,Truck,198201,03RD ST: ARTHUR AVE \ CARGO WAY to BURKE AVE (3400 - 3498) -- WEST --,3450 03RD ST,5211029,5211,29,21MFF-00115,EXPIRED,Cold Truck: Hamburger: cheeseburgers: hot dogs: hot sandwiches: cold sandwiches: egg muffins: cup of noodles: corn dogs: canned soup: coffee: hot cocoa: hot tea: gatorade: juice: milk: soda: water: fruits: fruit salad: rice pudding: yogurt: candy bars: chips: cookies: donuts: granola bars: muffins
1732702,Roadside Rotisserie Corporation / Country Grill,Truck,5874000,FRONT ST: BROADWAY to VALLEJO ST (800 - 899),90 BROADWAY,140007,140,7,23MFF-00022,APPROVED,Rotisserie Chicken: Ribs: Kickass Salad: Potatos w/fat dripping: chicken wrap.
1174530,CC Acquisition LLC,Push Cart,13060000,VALENCIA ST: 16TH ST to 17TH ST (500 - 599),560 VALENCIA ST,3568009,3568,9,18MFF-0034,REQUESTED,Chai Tea
1514026,F & C Catering,Truck,12491000,TENNESSEE ST: TENNESSEE ST to 26TH ST (1500 - 1599),1500 TENNESSEE ST,4294012,4294,12,21MFF-00035,EXPIRED,Cold Truck: Hot/Cold Sandwiches: Water: Soda: Juice: Snacks: Milk: Candies: Canned Food: Soups: Cup of Noodles: Fruit: Salad
1022810,Serendipity SF,Truck,3528000,CALIFORNIA ST: SANSOME ST to LEIDESDORFF ST (400 - 448),400 CALIFORNIA ST,239003,239,3,17MFF-0181,ISSUED,Meatloaf: Grilled Cheese: Chicken Sandwich: Caprese Salad: Kale Salad: Fries: Sweet Potato Fries: Mac and Cheese: Mashed Potatoes
1340418,Let's Be Frank,Push Cart,8393001,LINDEN ST: GOUGH ST to OCTAVIA ST (300 - 399),404 OCTAVIA ST,817033,817,33,19MFF-00104,EXPIRED,Hot dogs and chili
1213203,Marengo,Truck,13456000,WATERLOO ST: MARENGO ST to BAY SHORE BLVD (40 - 99),75 WATERLOO ST,5582001,5582,1,18MFF-0100,REQUESTED,Breakfast - egg: cheese: bacon: tomato: english muffin w/ butter: jam: or nutella: hard boiled eggs: fruit medley: water: coffee: milk: carrot juice: orange juice
1723816,Natan's Catering,Truck,4345000,CONNECTICUT ST: 17TH ST to MARIPOSA ST (100 - 199),146 CONNECTICUT ST,3983037,3983,37,23MFF-00006,APPROVED,Burgers: melts: hot dogs: burritos:sandwiches: fries: onion rings: drinks
1332942,Mini Mobile Food Catering,Truck,5861002,FREMONT ST: TRANSBAY HUMP to NATOMA ST (116 - 169),147 FREMONT ST,3719003,3719,3,19MFF-00041,EXPIRED,Cold Truck: Corn Dogs: Noodle Soups: Candy: Pre-packaged Snacks: Sandwiches: Chips: Coffee: Tea: Various Beverages
1658394,BH & MT LLC,Truck,8764101,MARKET ST: CHURCH ST to 15TH ST (2101 - 2195) -- SOUTH --,2145 MARKET ST,3543003B,3543,003B,22MFF-00059,EXPIRED,Cold Truck: Breakfast: Sandwiches: Salads: Pre-Packaged Snacks: Beverages
1730563,DO UC US Mobile Catering,Truck,10293000,PARNASSUS AVE: HILLWAY AVE to 03RD AVE (400 - 599),400 PARNASSUS AVE,1756001,1756,1,23MFF-00015,APPROVED,Cold truck: sandwiches: salads: beverages: chips: candy: cookies: coffee: tea: drinks
1351263,Isidoro Serrano,Push Cart,1108000,21ST ST: CAPP ST to MISSION ST (3150 - 3199),2501 MISSION ST,3615070,3615,70,19MFF-00075,EXPIRED,
1199051,Munch India,Truck,3528000,CALIFORNIA ST: SANSOME ST to LEIDESDORFF ST (400 - 448),400 CALIFORNIA ST,239003,239,3,18MFF-0088,REQUESTED,Daily rotating menus consisting of various local & organic vegetable: poultry: meat: seafood : rice & bread dishes.
1568970,Fillmore Square,Truck,13536101,WEBSTER ST: EDDY ST to ELLIS ST (1201 - 1299) -- WEST --,1223 WEBSTER ST,732001,732,1,21MFF-00101,EXPIRED,Breakfast and lunch items with a nod to various cultures
1591810,Flavors of Africa,Truck,7032000,HOWARD ST: FREMONT ST to 01ST ST (400 - 499),405 HOWARD ST,3737030,3737,30,22MFF-00017,SUSPEND,Meat and vegi rice bowls: meat and vegi salad bowls: meat and vegi wraps: drinks and juices.
1527317,"BOWL'D ACAI, LLC.",Truck,9698000,NORTH POINT ST: LAGUNA ST to BUCHANAN ST (1500 - 1599),15 MARINA BLVD,446002,446,2,21MFF-00009,REQUESTED,Acai Bowls: Poke Bowls: Smoothies: Juices
1746284,CARDONA'S FOOD TRUCK,Truck,9114000,MISSION ST: 14TH ST to 15TH ST (1800 - 1899),1800 MISSION ST,3547001,3547,1,23MFF-00052,APPROVED,Tacos: Burritos: Quesadillas: Various Drinks
1729534,Senor Sisig,Truck,3143000,BROADWAY: DAVIS ST to FRONT ST (50 - 99),90 BROADWAY,140007,140,7,23MFF-00012,APPROVED,Senor Sisig: Filipino fusion food: tacos: burritos: nachos: rice plates. Various beverages.Chairman Bao: Vegetable and meat sandwiches filled with Asian-flavored meats and vegetables.
1738646,Eva's Catering,Truck,5340000,EVANS AVE: NAPOLEON ST \ TOLAND ST to MARIN ST (2000 - 2099),2045 EVANS AVE,4343002,4343,2,23MFF-00042,APPROVED,Cold Truck: Burrito: Corn Dog: Salads: Sandwiches: Quesadilla: Tacos: Fried Rice: Cow Mein: Chinese Rice: Noodle Plates: Soup: Bacon: Eggs: Ham: Avacado: Sausages: Beverages
1163791,"SOHOMEI, LLC",Truck,4083000,CLAY ST: BATTERY ST to SANSOME ST (400 - 499),432 CLAY ST,206006,206,6,18MFF-0028,REQUESTED,COLD TRUCK. Deli: bbq chicken skewer: Chinese spring roll: Chinese fried rice/noodle: fried chicken leg/wing: bbq chicken sandwich: chicken cheese burger: burrito: lumpia. Snack: sunflower seeds: muffins: chips: snickers: kit-kat: 10 types of chocolate. Drinks: Coke: 7-Up: Dr. Pepper: Pepsi: Redbull: Vitamin Water: Rockstar: Coconut Juice: Water. Hot drinks: coffee: tea.
1568975,California Kahve,Truck,7922000,LA PLAYA: LINCOLN WAY \ MARTIN LUTHER KING JR DR to IRVING ST (1200 - 1299),1234 GREAT HWY,1701006,1701,6,21MFF-00102,EXPIRED,Drip Coffee: Espresso Drinks: Matcha Green Tea: Black Teas: Herbal Teas: Crossaints: Savory and Sweet Breads
963996,Singh Brothers Ice Cream,Truck,7895000,KIRKWOOD AVE: NEWHALL ST to PHELPS ST (1600 - 1699),1698 KIRKWOOD AVE,5279027,5279,27,17MFF-0182,REQUESTED,Ice Cream: Pre-Packaged Chips: Candies: Bottled Water & Canned SODA
1585473,"San Francisco Street Foods, Inc.",Push Cart,11222000,SACRAMENTO ST: FRONT ST to BATTERY ST (300 - 399),1 THE EMBARCADERO,230028,230,28,21MFF-00144,EXPIRED,Hot dogs: condiments: soft pretzels: soft drinks: coffee: cold beverages: pastries: bakery goods: cookies: ice cream: candy: soups: churros: chestnuts: nuts: fresh fruit: fruit juices: desserts: potato chips and popcorn.
1575182,Park's Catering,Truck,3376000,BURKE AVE: START: 1500-1599 BLOCK to 03RD ST (1500 - 1599),1570 BURKE AVE,5203066,5203,66,21MFF-00115,EXPIRED,Cold Truck: Hamburger: cheeseburgers: hot dogs: hot sandwiches: cold sandwiches: egg muffins: cup of noodles: corn dogs: canned soup: coffee: hot cocoa: hot tea: gatorade: juice: milk: soda: water: fruits: fruit salad: rice pudding: yogurt: candy bars: chips: cookies: donuts: granola bars: muffins
1658389,BH & MT LLC,Truck,1232000,,401 23RD ST,4232010,4232,10,22MFF-00059,EXPIRED,Cold Truck: Breakfast: Sandwiches: Salads: Pre-Packaged Snacks: Beverages
1733612,Buenafe,Truck,9199000,MISSISSIPPI ST: 07TH ST \ 16TH ST to 17TH ST (1 - 99),901 16TH ST,3949001,3949,1,23MFF-00026,APPROVED,Tacos burritos quesadillas tortas pupusas flautas tamales
1732578,Plaza Garibaldy,Truck,9297000,MONTGOMERY ST: POST ST to SUTTER ST (1 - 99),1 MONTGOMERY ST,292002,292,2,23MFF-00017,APPROVED,Tacos: burritos: quesadillas
1575187,Park's Catering,Truck,5337000,EVANS AVE: RANKIN ST to SELBY ST (1800 - 1890),1801 EVANS AVE,5232005,5232,5,21MFF-00115,EXPIRED,Cold Truck: Hamburger: cheeseburgers: hot dogs: hot sandwiches: cold sandwiches: egg muffins: cup of noodles: corn dogs: canned soup: coffee: hot cocoa: hot tea: gatorade: juice: milk: soda: water: fruits: fruit salad: rice pudding: yogurt: candy bars: chips: cookies: donuts: granola bars: muffins
1657804,"San Francisco Carts & Concessions, Inc. DBA Stanley's Steamers Hot Dogs",Push Cart,6109000,GEARY ST: STOCKTON ST to POWELL ST (200 - 299),233 GEARY ST,314001,314,1,22MFF-00040,EXPIRED,Hot dogs: condiments: soft pretzels: soft drinks: coffee: cold beverages: pastries: bakery goods: cookies: ice cream: candy: soups: churros: chestnuts: nuts: fresh fruit: fruit juices: desserts: potato chips and popcorn.
1575185,Park's Catering,Truck,4615000,DAVIDSON AVE: RANKIN ST to SELBY ST (1600 - 1699),1650 DAVIDSON AVE,5215022,5215,22,21MFF-00115,EXPIRED,Cold Truck: Hamburger: cheeseburgers: hot dogs: hot sandwiches: cold sandwiches: egg muffins: cup of noodles: corn dogs: canned soup: coffee: hot cocoa: hot tea: gatorade: juice: milk: soda: water: fruits: fruit salad: rice pudding: yogurt: candy bars: chips: cookies: donuts: granola bars: muffins
1591847,Golden Gate Halal Food,Push Cart,8751101,MARKET ST: 07TH ST \ CHARLES J BRENHAM PL to 08TH ST \ GROVE ST \ HYDE ST (1101 - 1199) -- SOUTH --,1169 MARKET ST,3702051,3702,51,22MFF-00025,SUSPEND,Pulao Plates & Sandwiches: Various Drinks
1741655,Truly Food & More,Truck,9092000,MISSION ST: 02ND ST to NEW MONTGOMERY ST (600 - 634),602 MISSION ST,3707013,3707,13,23MFF-00046,APPROVED,Latin Food: Tacos: Pupusas: Vegetables: Salad: Waters: Sodas
1336734,Quan Catering,Truck,2107000,ALABAMA ST: TREAT AVE to 15TH ST (201 - 212),201 ALABAMA ST,3924 006,3924,6,19MFF-00055,EXPIRED,Cold Truck: Soft drinks: cup cakes: potato chips: cookies: gum: sandwiches (hot & cold): peanuts: muffins: coff (hot & cold): water: juice: yoplait: milk: orange juice: sunflower seeds: can foods: burritos: buscuits: chimichangas: rice krispies
1334599,Tacos El Ojo De Agua,Truck,177000,03RD ST: SOUTH PARK to VARNEY PL (548 - 586),551 03RD ST,3775025,3775,25,19MFF-00046,EXPIRED,Tacos: Burritos: Tortas: Quesadillas: Salads: Soup: Fruits: Juices: Soda: Water
